{
  "schema_version": 1,
  "gate": "upgrade",
  "milestone": "07-atomic-upgrades",
  "platform": "Linux",
  "architecture": "x86_64",
  "native_required": false,
  "timestamp": 1790905573.9243302,
  "passed": true,
  "scenarios": [
    {
      "test": "test_upgrade_compatibility",
      "result": "pass",
      "seconds": 0.1568185439973604,
      "assertions": 6
    },
    {
      "test": "test_upgrade_fault_rollback",
      "result": "pass",
      "seconds": 4.285267396000563,
      "assertions": 17,
      "measurements": [
        {
          "portable_transaction_cases": 92,
          "native_lifecycle_proven": 0
        }
      ]
    },
    {
      "test": "test_uninstall_preserve_delete",
      "result": "pass",
      "seconds": 1.062543480999011,
      "assertions": 9,
      "measurements": [
        {
          "portable_transaction_cases": 26,
          "native_lifecycle_proven": 0
        }
      ]
    }
  ],
  "purpose": "product",
  "tested_commit": "6619f662ad87a8b88719e0eecd0c93d882766082",
  "binary": {
    "sha256": "18aaae55f4493460988d41151746ea2eb7558d49c1d6620ea41e0b3653af3526",
    "source_commit": "6619f662ad87a8b88719e0eecd0c93d882766082",
    "vcs_modified": false
  },
  "clean_product_tree": true
}
