{
  "schema_version": 1,
  "gate": "privacy",
  "milestone": "08-local-observability",
  "platform": "Darwin",
  "architecture": "arm64",
  "native_required": false,
  "timestamp": 1791373799.39728,
  "passed": true,
  "scenarios": [
    {
      "test": "test_redaction_before_persistence",
      "result": "pass",
      "seconds": 3.7031815419995837,
      "assertions": 52
    },
    {
      "test": "test_diagnostic_archive_policy",
      "result": "pass",
      "seconds": 1.3966355419997853,
      "assertions": 45
    }
  ],
  "purpose": "product",
  "tested_commit": "353de6a43dde4e1998636d47a80730c90343d307",
  "binary": {
    "sha256": "10d498fce7675f6243fc3c1f7f84fef4d9814e77d449fe1a1ff40edbdd3700de",
    "source_commit": "353de6a43dde4e1998636d47a80730c90343d307",
    "vcs_modified": false
  },
  "clean_product_tree": true
}
