{
  "schema_version": 1,
  "gate": "install",
  "milestone": null,
  "platform": "Linux",
  "architecture": "x86_64",
  "native_required": true,
  "timestamp": 1790871769.0398216,
  "passed": false,
  "scenarios": [],
  "purpose": "product",
  "tested_commit": "ed3d3f3ce99dd6d45d1ad0d4bab90b7e0ddd911c",
  "blocked": "actual macOS Apple Silicon required",
  "clean_product_tree": true
}
