{
  "schema_version": 1,
  "gate": "upgrade",
  "milestone": "07-atomic-upgrades",
  "platform": "Linux",
  "architecture": "x86_64",
  "native_required": false,
  "timestamp": 1790907626.0365589,
  "passed": true,
  "scenarios": [
    {
      "test": "test_upgrade_compatibility",
      "result": "pass",
      "seconds": 2.911499248002656,
      "assertions": 11,
      "measurements": [
        {
          "portable_transaction_cases": 3,
          "native_lifecycle_proven": 0
        }
      ]
    },
    {
      "test": "test_upgrade_fault_rollback",
      "result": "pass",
      "seconds": 5.118104107998079,
      "assertions": 17,
      "measurements": [
        {
          "portable_transaction_cases": 92,
          "native_lifecycle_proven": 0
        }
      ]
    },
    {
      "test": "test_uninstall_preserve_delete",
      "result": "pass",
      "seconds": 1.8794612179990509,
      "assertions": 9,
      "measurements": [
        {
          "portable_transaction_cases": 26,
          "native_lifecycle_proven": 0
        }
      ]
    }
  ],
  "purpose": "product",
  "tested_commit": "17631ea9ac6bb18a16aaa855c01a55c5eebfc6e6",
  "binary": {
    "sha256": "75d40ebf5bdc330413ea784dd9e0bf6b3809f1f02c51797d2b5b23ec614982e7",
    "source_commit": "17631ea9ac6bb18a16aaa855c01a55c5eebfc6e6",
    "vcs_modified": false
  },
  "clean_product_tree": true
}
