{
  "schema_version": 1,
  "gate": "privacy",
  "milestone": "08-local-observability",
  "platform": "Linux",
  "architecture": "x86_64",
  "native_required": false,
  "timestamp": 1790871768.7500327,
  "passed": false,
  "scenarios": [
    {
      "test": "test_redaction_before_persistence",
      "result": "fail",
      "seconds": 0.07024720899971726,
      "assertions": 6,
      "error_type": "AssertionError",
      "error_sha256": "1e839344c50a8fa6d02dd2d8181a88d65d0d11374109c5bd15cbd26327dc72ed"
    },
    {
      "test": "test_diagnostic_archive_policy",
      "result": "fail",
      "seconds": 0.05628925299970433,
      "assertions": 6,
      "error_type": "AssertionError",
      "error_sha256": "1e839344c50a8fa6d02dd2d8181a88d65d0d11374109c5bd15cbd26327dc72ed"
    }
  ],
  "purpose": "product",
  "tested_commit": "ed3d3f3ce99dd6d45d1ad0d4bab90b7e0ddd911c",
  "binary": {
    "sha256": "32e6404586304c6908a5e5f5b7e7ef43f326509514fcf33db76a2187eb7becfe",
    "source_commit": "ed3d3f3ce99dd6d45d1ad0d4bab90b7e0ddd911c",
    "vcs_modified": false
  },
  "clean_product_tree": true
}
